{
  "schemaVersion": 1,
  "revision": 13,
  "availability": "available",
  "playback": "playing",
  "displayZone": {
    "name": "Gallery"
  },
  "nowPlaying": null,
  "progress": {
    "positionSeconds": 300,
    "durationSeconds": 234,
    "sampledAt": "2026-08-15T19:20:00Z"
  },
  "artwork": null
}
