{
  "schemaVersion": 1,
  "revision": 9,
  "availability": "available",
  "playback": "loading",
  "displayZone": {
    "name": "Gallery"
  },
  "nowPlaying": {
    "title": "A Moment Apart",
    "artist": "ODESZA",
    "album": "A Moment Apart"
  },
  "progress": {
    "positionSeconds": 91,
    "durationSeconds": 234,
    "sampledAt": "2026-08-15T19:20:00Z"
  },
  "artwork": {
    "revision": 3,
    "path": "fixtures/artwork/playing.svg"
  }
}
